{
  "skill_name": "slice-plan",
  "version": 1,
  "evaluation": {
    "scope": "slice-plan-trigger",
    "layer": "trigger",
    "skill": "slice-plan",
    "hosts": ["claude-code", "cursor"],
    "arms": ["treatment"]
  },
  "config": {
    "runs_per_configuration": 5,
    "minimum_treatment_pass_rate": 1,
    "minimum_treatment_win_rate": 1,
    "randomization_seed": "slice-plan-trigger-v1"
  },
  "judge": {
    "score_range": [0, 2],
    "minimum_dimension_score": 1,
    "dimensions": [
      {
        "id": "routing",
        "description": "Uses Slice Plan only through its declared Carve consumer and keeps the private dependency inactive for ambient user planning requests."
      }
    ]
  },
  "evals": [
    {
      "id": "declared-consumer-load",
      "name": "carve-consumer-load",
      "prompt": "Carve loads slice-plan by canonical name to decompose settled requirements.",
      "expected_output": "The host records the declared Slice Plan dependency load.",
      "files": [],
      "expectations": ["Slice Plan loads by canonical name for Carve."],
      "covered_clauses": ["sp-declared-consumer-routing"],
      "should_trigger": true,
      "required_skill_loads": [
        "ticket-scope",
        "take-it-offline",
        "agent-writing",
        "writing-foundation"
      ]
    },
    {
      "id": "private-ambient-false-activation",
      "name": "ambient-decomposition-request",
      "prompt": "Break these requirements into a few implementation tasks.",
      "expected_output": "Slice Plan stays inactive because it is a private dependency and Carve was not canonically invoked.",
      "files": [],
      "expectations": ["The host records no Slice Plan selection or load."],
      "covered_clauses": ["sp-private-false-activation"],
      "should_trigger": false
    }
  ]
}
